{
  "schema_version": "1.0",
  "skill_id": "SK-000001",
  "created_at": "2026-03-23T10:02:53.757Z",
  "updated_at": "2026-03-23T10:02:58.530Z",
  "title": "Prevent generated-diagram-labels-don-t-match-act",
  "summary": "Reusable prevention workflow for the failure family 'generated-diagram-labels-don-t-match-act', centered on invariant 'generated_diagram_labels_don_t_match_act' and repair operator 'fix-generated-diagram-labels-don-t-match-act'.",
  "status": "admitted",
  "category": "quality",
  "tags": [
    "failure-genome",
    "generated",
    "quality",
    "replay",
    "skillgraph"
  ],
  "source_type": "failure_genome",
  "source_ids": {
    "genome_id": "FG-000001",
    "incident_id": "INC-000001"
  },
  "triggers": [
    "Signals of family: generated-diagram-labels-don-t-match-act",
    "Invariant at risk: generated_diagram_labels_don_t_match_act"
  ],
  "when_to_use": [
    "Use when current work resembles the 'generated-diagram-labels-don-t-match-act' failure family.",
    "Use before marking a change as done when the repair touches production or a shared contract."
  ],
  "when_not_to_use": [
    "Do not use as a substitute for actual debugging when the failure pattern is unrelated.",
    "Do not auto-apply destructive changes without explicit approval."
  ],
  "inputs": [
    "Current task summary",
    "Relevant diff / changed files",
    "Verification target (environment, contract, or test surface)"
  ],
  "steps": [
    {
      "title": "Inspect family signals",
      "instruction": "Check whether the current task matches the 'generated-diagram-labels-don-t-match-act' pattern and restate the invariant 'generated_diagram_labels_don_t_match_act'.",
      "expected_output": "Clear yes/no match plus invariant statement.",
      "risk": "low"
    },
    {
      "title": "Apply repair operator",
      "instruction": "Apply or adapt the repair operator 'fix-generated-diagram-labels-don-t-match-act' to the current context rather than copying a prior fix blindly.",
      "expected_output": "Targeted remediation plan tied to the current code path.",
      "risk": "medium"
    },
    {
      "title": "Verify on the real surface",
      "instruction": "Run the smallest trustworthy verification on the real target surface (production-like env, actual schema path, or real contract boundary).",
      "expected_output": "Verification evidence tied to the touched surface.",
      "risk": "medium"
    },
    {
      "title": "Holdout regression check",
      "instruction": "Check at least one adjacent family or holdout surface to reduce negative transfer and regression risk.",
      "expected_output": "Regression note or holdout pass result.",
      "risk": "medium"
    }
  ],
  "success_signals": [
    "Invariant 'generated_diagram_labels_don_t_match_act' is explicitly verified.",
    "Real target surface passes after the repair.",
    "No obvious holdout regression is introduced."
  ],
  "failure_modes": [
    "Repair copied from the old incident without adapting to the new context.",
    "Verification performed only on a fake or incomplete surface.",
    "Regression introduced in an adjacent contract or family."
  ],
  "safety_notes": [
    "Require explicit approval for destructive commands, auth changes, or billing-impacting actions.",
    "Preserve backward compatibility and wrappers until stability is proven."
  ],
  "maintainability_notes": [
    "Keep the skill tied to the originating genome for lineage and future replay review.",
    "Split the skill if multiple unrelated invariants accumulate."
  ],
  "cost_notes": [
    "Prefer the smallest real verification that still proves the invariant.",
    "Avoid loading large context windows when a focused replay or diff is enough."
  ],
  "relations": [
    {
      "type": "derived_from_genome",
      "target": "FG-000001",
      "weight": 1,
      "evidence": [
        "family=generated-diagram-labels-don-t-match-act",
        "repair=fix-generated-diagram-labels-don-t-match-act"
      ]
    }
  ],
  "evaluation": {
    "safety": 0.85,
    "completeness": 1,
    "executability": 1,
    "maintainability": 1,
    "cost_awareness": 1,
    "overall": 0.9625,
    "recommendation": "admit",
    "rationale": [
      "structure is complete enough for reuse"
    ]
  },
  "canonical_hash": "7a7eb0f457da9508907d8a0ea18ba68dd411de4f1d9b141e34800d9441d54fd8",
  "semantic_fingerprint": "generated|match|act|diagram|don|labels|or|surface|family|invariant|repair|to|is|regression|verification|contract",
  "duplicate_of": null,
  "published_skill_path": null
}
